{
  "$schema": "https://json-schema.org/draft/2020-12/schema",
  "$id": "https://raw.githubusercontent.com/devictoribero/devflow/main/plugins/devflow/shared/contract.schema.json",
  "title": "devflow agent contract",
  "description": "Tells the devflow skills how this repository is verified, run and documented. Private to each developer: stored under ~/.config/devflow/contracts/<host>/<owner>/<repo>.json, never inside the repository.",
  "type": "object",
  "required": [
    "version"
  ],
  "additionalProperties": false,
  "properties": {
    "$schema": {
      "type": "string"
    },
    "version": {
      "description": "Contract format version. Bumped only on breaking changes. Migrating older contracts is planned for onboard's audit mode.",
      "type": "integer",
      "enum": [
        1
      ]
    },
    "workflow": {
      "description": "Who owns the development cycle in this repository. devflow (default): the devflow skills run the cycle. repo: the repository's own workflow applies, devflow's cycle skills stand aside and point to it, and hooks stay silent. Knowledge skills still apply.",
      "type": "string",
      "enum": [
        "devflow",
        "repo"
      ]
    },
    "verify": {
      "description": "Shell commands, run from the repository root. Each must exit 0 when the change is good. Required unless workflow is repo. A missing e2e means the repo has no end-to-end suite yet: skills skip that check and report it, never improvise one.",
      "type": "object",
      "required": [
        "full"
      ],
      "additionalProperties": false,
      "properties": {
        "fast": {
          "description": "Seconds-range check for quick feedback after edits, e.g. type-check plus lint. A Stop hook that runs it is planned.",
          "type": "string",
          "minLength": 1
        },
        "full": {
          "description": "Everything CI checks before merge. verify runs it, and nothing merges without a green run on the current commit.",
          "type": "string",
          "minLength": 1
        },
        "e2e": {
          "description": "End-to-end suite over the critical flows. Optional while the repo has none.",
          "type": "string",
          "minLength": 1
        }
      }
    },
    "run": {
      "description": "How an agent starts the app to look at a change.",
      "type": "object",
      "additionalProperties": false,
      "required": [],
      "properties": {
        "dev": {
          "description": "Starts the app against the default backend. Prefer a mode that needs no real backend or credentials.",
          "type": "string",
          "minLength": 1
        },
        "url": {
          "description": "Where the running app answers.",
          "type": "string",
          "minLength": 1
        },
        "mocked": {
          "description": "true when run.dev works without a real backend or secrets.",
          "type": "boolean"
        },
        "login": {
          "description": "Path to a doc that explains how an agent signs in to the running app.",
          "type": "string",
          "minLength": 1
        },
        "environments": {
          "description": "Backends the app can run against, when there is more than one. Before starting work on a feature, implement asks which one to use, because the choice usually depends on who you are working with.",
          "type": "array",
          "items": {
            "type": "object",
            "required": [
              "name",
              "dev"
            ],
            "additionalProperties": false,
            "properties": {
              "name": {
                "type": "string",
                "minLength": 1
              },
              "dev": {
                "description": "Command that starts the app against this backend.",
                "type": "string",
                "minLength": 1
              },
              "e2e": {
                "description": "Headless end-to-end command against this backend, when it differs from verify.e2e.",
                "type": "string",
                "minLength": 1
              },
              "note": {
                "description": "When to choose this backend.",
                "type": "string",
                "minLength": 1
              }
            }
          }
        }
      }
    },
    "docs": {
      "description": "Repository-relative paths to the domain knowledge agents must read.",
      "type": "object",
      "additionalProperties": false,
      "properties": {
        "glossary": {
          "description": "Ubiquitous-language glossary, usually GLOSSARY.md (older repos: CONTEXT.md).",
          "type": "string",
          "minLength": 1
        },
        "decisions": {
          "description": "Directory of architecture decision records.",
          "type": "string",
          "minLength": 1
        },
        "specs": {
          "description": "Directory of business-rule specs.",
          "type": "string",
          "minLength": 1
        },
        "prd": {
          "description": "Directory where to-spec writes specs when the tracker is local.",
          "type": "string",
          "minLength": 1
        }
      }
    },
    "tracker": {
      "description": "Where specs and tickets live. to-spec and to-tickets write there; implement and implement-spec read from there. The SessionStart adapter hands it to every skill.",
      "type": "object",
      "required": [
        "kind"
      ],
      "additionalProperties": false,
      "properties": {
        "kind": {
          "type": "string",
          "enum": [
            "none",
            "local",
            "github",
            "gitlab",
            "jira",
            "linear"
          ]
        },
        "project": {
          "description": "Project key or board identifier, e.g. a Jira key.",
          "type": "string",
          "minLength": 1
        },
        "skill": {
          "description": "Repository skill that knows the tracker's fields and templates. When set, every tracker operation goes through it.",
          "type": "string",
          "minLength": 1
        },
        "path": {
          "description": "For kind local: directory holding one folder per feature with spec.md and issues/NN-slug.md files. Usually .scratch.",
          "type": "string",
          "minLength": 1
        },
        "labels": {
          "description": "Label strings this tracker uses for the five triage roles, when they differ from the role names.",
          "type": "object",
          "additionalProperties": false,
          "properties": {
            "needs-triage": {
              "type": "string",
              "minLength": 1
            },
            "needs-info": {
              "type": "string",
              "minLength": 1
            },
            "ready-for-agent": {
              "type": "string",
              "minLength": 1
            },
            "ready-for-human": {
              "type": "string",
              "minLength": 1
            },
            "wontfix": {
              "type": "string",
              "minLength": 1
            }
          }
        }
      }
    },
    "review": {
      "description": "Extra review inputs. code-review reads the standards as documented coding standards; the skills run after it.",
      "type": "object",
      "additionalProperties": false,
      "properties": {
        "skills": {
          "type": "array",
          "items": {
            "type": "string",
            "minLength": 1
          },
          "uniqueItems": true
        },
        "standards": {
          "description": "Repository files that document coding standards beyond the ones code-review finds on its own, e.g. docs/conventions.md.",
          "type": "array",
          "items": {
            "type": "string",
            "minLength": 1
          },
          "uniqueItems": true
        }
      }
    },
    "pr": {
      "description": "Pull request conventions.",
      "type": "object",
      "additionalProperties": false,
      "properties": {
        "base": {
          "description": "Branch pull requests target.",
          "type": "string",
          "minLength": 1
        },
        "template": {
          "description": "Path to the pull request body template.",
          "type": "string",
          "minLength": 1
        },
        "evidence": {
          "description": "Command that uploads screenshots and prints markdown to embed.",
          "type": "string",
          "minLength": 1
        }
      }
    }
  }
}
