{
  "$schema": "https://raw.githubusercontent.com/devictoribero/devflow/main/plugins/devflow/shared/contract.schema.json",
  "version": 1,
  "verify": {
    "fast": "",
    "full": "",
    "e2e": ""
  },
  "run": {
    "dev": "",
    "url": "",
    "mocked": false,
    "login": ""
  },
  "docs": {
    "glossary": "",
    "decisions": "",
    "specs": "",
    "prd": ""
  },
  "tracker": {
    "kind": "none",
    "path": "",
    "project": "",
    "skill": ""
  },
  "review": {
    "skills": []
  },
  "pr": {
    "base": "main",
    "template": "",
    "evidence": ""
  }
}
